,Instruction,Output
402,မြန်မာနိုင်ငံ၏ သစ်သီးဝလံစိုက်ပျိုးရေးအခြေအနေကို ဖော်ပြပါ။,မြန်မာနိုင်ငံတွင် သရက်၊ ဖရဲ၊ သခွားမျိုးစုံ၊ ငှက်ပျောနှင့် နာနတ်သီးတို့ကို အဓိကစိုက်ပျိုးသည်။ ရှမ်းပြည်နယ်၊ မန္တလေးတိုင်းနှင့် စစ်ကိုင်းတိုင်းတို့သည် သစ်သီးဝလံအများဆုံး ထွက်ရှိရာဒေသများ ဖြစ်သည်။ ပြည်တွင်းစားသုံးမှုသာမက တရုတ်နိုင်ငံသို့ တင်ပို့ရောင်းချမှုလည်း တိုးတက်လျက်ရှိသည်။
403,မြန်မာနိုင်ငံ၏ မွေးမြူရေးကဏ္ဍအခြေအနေကို ရှင်းပြပါ။,မြန်မာနိုင်ငံ၏ မွေးမြူရေးကဏ္ဍတွင် ကြက်၊ ဝက်၊ နွား၊ ဆိတ်နှင့် ငါးမွေးမြူရေးလုပ်ငန်းများ ပါဝင်သည်။ နိုင်ငံခြားရင်းနှီးမြှုပ်နှံမှုများ ဝင်ရောက်လာပြီး မွေးမြူရေးခြံကြီးများ ပေါ်ပေါက်လာသည်။ သို့သော် တိရစ္ဆာန်အစာဈေးနှုန်းမြင့်တက်မှု၊ ရောဂါဘေးအန္တရာယ်နှင့် နည်းပညာလိုအပ်ချက်တို့ကြောင့် စိန်ခေါ်မှုများ ရှိနေသေးသည်။
404,မြန်မာနိုင်ငံ၏ ရာသီအလိုက်စိုက်ပျိုးရေးပုံစံများကို ဖော်ပြပါ။,မြန်မာနိုင်ငံတွင် မိုးရာသီ (မေလမှ အောက်တိုဘာလ) တွင် စပါး၊ ပဲမျိုးစုံနှင့် ဆီထွက်သီးနှံများကို အဓိကစိုက်ပျိုးသည်။ ဆောင်းရာသီ (နိုဝင်ဘာလမှ ဖေဖော်ဝါရီလ) တွင် ဆောင်းသီးနှံများဖြစ်သော ကြက်သွန်၊ အာလူး၊ ခရမ်းချဉ်သီးတို့ကို စိုက်ပျိုးသည်။ နွေရာသီ (မတ်လမှ မေလ) တွင် ဖရဲသီး၊ သခွားမျိုးစုံနှင့် နွေစပါးတို့ကို စိုက်ပျိုးလေ့ရှိသည်။
405,မြန်မာနိုင်ငံ၏ ဆားငန်ရေဒဏ်ခံစိုက်ပျိုးရေးအခြေအနေကို ဖော်ပြပါ။,မြန်မာနိုင်ငံ၏ ကမ်းရိုးတန်းဒေသများဖြစ်သော ဧရာဝတီတိုင်း၊ ရခိုင်ပြည်နယ်နှင့် တနင်္သာရီတိုင်းတို့တွင် ဆားငန်ရေဒဏ်ခံစိုက်ပျိုးရေးကို လုပ်ကိုင်ကြသည်။ ဆားငန်ဒဏ်ခံနိုင်သော စပါးမျိုးများ၊ ရေငန်ငါးမွေးမြူရေးနှင့် ပုစွန်မွေးမြူရေးလုပ်ငန်းများကို အဓိကဆောင်ရွက်ကြသည်။ သို့သော် ရာသီဥတုပြောင်းလဲမှုကြောင့် ပင်လယ်ရေမျက်နှာပြင် မြင့်တက်လာမှုသည် စိန်ခေါ်မှုတစ်ရပ် ဖြစ်နေသည်။
406,မြန်မာနိုင်ငံ၏ ဥယျာဉ်ခြံစိုက်ပျိုးရေးအခြေအနေကို ရှင်းပြပါ။,မြန်မာနိုင်ငံ၏ ဥယျာဉ်ခြံစိုက်ပျိုးရေးတွင် ကော်ဖီ၊ လက်ဖက်၊ ရာဘာ၊ ကွမ်းသီးနှင့် အခြားနှစ်ရှည်ပင်များ စိုက်ပျိုးခြင်း ပါဝင်သည်။ ရှမ်းပြည်နယ်နှင့် ချင်းပြည်နယ်တို့တွင် ကော်ဖီနှင့် လက်ဖက်စိုက်ပျိုးမှု ထင်ရှားပြီး မွန်ပြည်နယ်နှင့် တနင်္သာရီတိုင်းတို့တွင် ရာဘာစိုက်ပျိုးမှု များပြားသည်။ ဥယျာဉ်ခြံသီးနှံများသည် တန်ဖိုးမြင့်ထုတ်ကုန်များ ထုတ်လုပ်နိုင်သည်။
407,မြန်မာနိုင်ငံ၏ ဆီအုန်းစိုက်ပျိုးရေးအခြေအနေကို ရှင်းပြပါ။,မြန်မာနိုင်ငံ၏ ဆီအုန်းစိုက်ပျိုးရေးကို တနင်္သာရီတိုင်းဒေသကြီးတွင် အဓိကတွေ့ရသည်။ နိုင်ငံခြားရင်းနှီးမြှုပ်နှံမှုများကြောင့် စိုက်ဧက တိုးချဲ့လာသည်။ သို့သော် သစ်တောပြုန်းတီးမှုနှင့် ဒေသခံများ၏ မြေယာအခွင့်အရေးဆိုင်ရာ ပြဿနာများ ဖြစ်ပေါ်နေသည်။ ရေရှည်တည်တံ့သော ထုတ်လုပ်မှုနည်းလမ်းများ လိုအပ်နေသေးသည်။
408,မြန်မာနိုင်ငံ၏ ကော်ဖီစိုက်ပျိုးထုတ်လုပ်မှုအခြေအနေကို ဖော်ပြပါ။,မြန်မာနိုင်ငံ၏ ကော်ဖီစိုက်ပျိုးထုတ်လုပ်မှုကို ရှမ်းပြည်နယ်၊ မန္တလေးတိုင်းနှင့် ချင်းပြည်နယ်တို့တွင် အဓိကတွေ့ရသည်။ အရည်အသွေးမြင့် Arabica ကော်ဖီမျိုးကို အများဆုံးစိုက်ပျိုးသည်။ ပြည်တွင်းစားသုံးမှုသာမက ဂျပန်၊ ကိုရီးယားနှင့် ဥရောပနိုင်ငံများသို့ တင်ပို့ရောင်းချမှု တိုးတက်လာသည်။ သို့သော် နိုင်ငံတကာစျေးကွက်တွင် ယှဉ်ပြိုင်နိုင်ရန် အရည်အသွေးထိန်းချုပ်မှုနှင့် ကုန်ထုတ်လုပ်မှုစွမ်းရည် တိုးမြှင့်ရန် လိုအပ်နေသေးသည်။
409,မြန်မာနိုင်ငံ၏ ဝါစိုက်ပျိုးထုတ်လုပ်မှုအခြေအနေကို ရှင်းပြပါ။,မြန်မာနိုင်ငံ၏ ဝါစိုက်ပျိုးထုတ်လုပ်မှုကို မကွေးတိုင်း၊ မန္တလေးတိုင်းနှင့် စစ်ကိုင်းတိုင်းတို့တွင် အဓိကတွေ့ရသည်။ ပြည်တွင်းအထည်ချုပ်လုပ်ငန်းအတွက် အဓိကထုတ်လုပ်ပေးနေသည်။ သို့သော် ကမ္ဘာ့ဈေးကွက်တွင် ယှဉ်ပြိုင်နိုင်စွမ်း နည်းပါးနေသေးသည်။ ဝါမျိုးကောင်းမျိုးသန့်များ တိုးချဲ့စိုက်ပျိုးခြင်း၊ စိုက်ပျိုးရေးနည်းစနစ်များ ပြုပြင်ခြင်းဖြင့် အထွက်နှုန်းနှင့် အရည်အသွေး တိုးတက်အောင် ဆောင်ရွက်နေသည်။
410,မြန်မာနိုင်ငံ၏ ရာဘာစိုက်ပျိုးထုတ်လုပ်မှုအခြေအနေကို ဖော်ပြပါ။,မြန်မာနိုင်ငံ၏ ရာဘာစိုက်ပျိုးထုတ်လုပ်မှုကို မွန်ပြည်နယ်၊ တနင်္သာရီတိုင်းနှင့် ကရင်ပြည်နယ်တို့တွင် အဓိကတွေ့ရသည်။ ပြည်တွင်းသုံးစွဲမှုအပြင် တရုတ်နိုင်ငံသို့ အဓိကတင်ပို့ရောင်းချသည်။ သို့သော် ကမ္ဘာ့ဈေးကွက်တွင် ရာဘာဈေးနှုန်းကျဆင်းမှုကြောင့် တောင်သူများ အခက်အခဲဖြစ်နေသည်။ ထုတ်လုပ်မှုကုန်ကျစရိတ် လျှော့ချခြင်း၊ အရည်အသွေးမြှင့်တင်ခြင်းနှင့် တန်ဖိုးမြှင့်ထုတ်ကုန်များ ထုတ်လုပ်ခြင်းတို့ဖြင့် ဖြေရှင်းရန် ကြိုးပမ်းနေသည်။
411,မြန်မာနိုင်ငံ၏ ပန်းမန်စိုက်ပျိုးရေးအခြေအနေကို ရှင်းပြပါ။,မြန်မာနိုင်ငံ၏ ပန်းမန်စိုက်ပျိုးရေးကို မန္တလေးတိုင်း၊ ရှမ်းပြည်နယ်နှင့် ပဲခူးတိုင်းတို့တွင် အဓိကတွေ့ရသည်။ နှင်းဆီ၊ ကြာ၊ စသည့်ပန်းမျိုးစုံကို စိုက်ပျိုးကြသည်။ ပြည်တွင်းဈေးကွက်အပြင် ထိုင်းနိုင်ငံသို့ ပန်းများ တင်ပို့ရောင်းချသည်။ နိုင်ငံခြားရင်းနှီးမြှုပ်နှံမှုများ ဝင်ရောက်လာပြီး ခေတ်မီစိုက်ပျိုးရေးနည်းစနစ်များ စတင်အသုံးပြုလာသည်။ သို့သော် သယ်ယူပို့ဆောင်ရေးနှင့် အအေးခန်းသိုလှောင်မှုစနစ် တိုးတက်ရန် လိုအပ်နေသေးသည်။
412,မြန်မာနိုင်ငံ၏ စပါးမျိုးစေ့ထုတ်လုပ်မှုအခြေအနေကို ဖော်ပြပါ။,မြန်မာနိုင်ငံ၏ စပါးမျိုးစေ့ထုတ်လုပ်မှုကို စိုက်ပျိုးရေးဦးစီးဌာနနှင့် စိုက်ပျိုးရေးသုတေသနဦးစီးဌာနတို့က ဦးဆောင်ဆောင်ရွက်နေသည်။ ရာသီဥတုဒဏ်ခံနိုင်သောမျိုး၊ ရောဂါဒဏ်ခံနိုင်သောမျိုးနှင့် အထွက်နှုန်းကောင်းမျိုးများကို ဖော်ထုတ်ထုတ်လုပ်နေသည်။ သို့သော် တောင်သူများထံ မျိုးကောင်းမျိုးသန့်များ ပုံမှန်ဖြန့်ဖြူးပေးနိုင်ရန် လိုအပ်နေသေးသည်။ ပုဂ္ဂလိကကဏ္ဍနှင့် ပူးပေါင်း၍ မျိုးစေ့ထုတ်လုပ်မှု တိုးမြှင့်ရန် စီစဉ်ဆောင်ရွက်နေသည်။
413,မြန်မာနိုင်ငံ၏ ဇီဝလောင်စာထုတ်လုပ်မှုအခြေအနေကို ရှင်းပြပါ။,မြန်မာနိုင်ငံတွင် ဇီဝလောင်စာထုတ်လုပ်မှုကို စတင်လုပ်ဆောင်နေသည်။ ဆီအုန်း၊ ကြံနှင့် အခြားစိုက်ပျိုးရေးစွန့်ပစ်ပစ္စည်းများမှ ဘိုင်အိုဒီဇယ်နှင့် ဘိုင်အိုအီသနောထုတ်လုပ်ရန် စီမံကိန်းများ ရှိသည်။ သို့သော် လက်ရှိတွင် စီးပွားဖြစ်ထုတ်လုပ်နိုင်သည့် အဆင့်သို့ မရောက်ရှိသေးပါ။ စိုက်ပျိုးရေးထွက်ကုန်များကို အစားအစာဖူလုံရေးနှင့် လောင်စာထုတ်လုပ်ရေးကြား ဟန်ချက်ညီအောင် စီမံခန့်ခွဲရန် လိုအပ်နေသည်။
414,မြန်မာနိုင်ငံ၏ ငါးမွေးမြူရေးလုပ်ငန်းအခြေအနေကို ဖော်ပြပါ။,မြန်မာနိုင်ငံ၏ ငါးမွေးမြူရေးလုပ်ငန်းကို ဧရာဝတီတိုင်း၊ ပဲခူးတိုင်းနှင့် ရန်ကုန်တိုင်းတို့တွင် အဓိကတွေ့ရသည်။ ငါးကြင်း၊ ငါးခုံး၊ တီလားပီးယားနှင့် ငါးကြီးမျိုးများကို အများဆုံးမွေးမြူကြသည်။ ပြည်တွင်းစားသုံးမှုအပြင် အိမ်နီးချင်းနိုင်ငံများသို့ တင်ပို့ရောင်းချသည်။ သို့သော် အရည်အသွေးထိန်းချုပ်မှု၊ ရောဂါကာကွယ်ထိန်းချုပ်မှုနှင့် စွန့်ပစ်ရေစီမံခန့်ခွဲမှုတို့တွင် စိန်ခေါ်မှုများ ရှိနေသေးသည်။
415,မြန်မာနိုင်ငံ၏ ကြံစိုက်ပျိုးထုတ်လုပ်မှုအခြေအနေကို ရှင်းပြပါ။,မြန်မာနိုင်ငံ၏ ကြံစိုက်ပျိုးထုတ်လုပ်မှုကို မန္တလေးတိုင်း၊ စစ်ကိုင်းတိုင်းနှင့် ရှမ်းပြည်နယ်တို့တွင် အဓိကတွေ့ရသည်။ သကြားစက်ရုံများအတွက် ကုန်ကြမ်းအဖြစ် အသုံးပြုသည်။ ပြည်တွင်းစားသုံးမှုအတွက် အဓိကထုတ်လုပ်ပြီး ပိုလျှံမှသာ ပြည်ပတင်ပို့သည်။ ရေသွင်းစနစ် တိုးတက်အောင်လုပ်ဆောင်ခြင်း၊ စက်မှုလယ်ယာသုံးစွဲမှု တိုးမြှင့်ခြင်းဖြင့် အထွက်နှုန်း တိုးတက်အောင် ကြိုးပမ်းနေသည်။
416,မြန်မာနိုင်ငံ၏ လက်ဖက်စိုက်ပျိုးထုတ်လုပ်မှုအခြေအနေကို ဖော်ပြပါ။,မြန်မာနိုင်ငံ၏ လက်ဖက်စိုက်ပျိုးထုတ်လုပ်မှုကို ရှမ်းပြည်နယ်နှင့် စစ်ကိုင်းတိုင်းတို့တွင် အဓိကတွေ့ရသည်။ လက်ဖက်ခြောက်နှင့် လက်ဖက်စိုဟူ၍ ထုတ်လုပ်သည်။ ပြည်တွင်းစားသုံးမှုအပြင် တရုတ်နှင့် ထိုင်းနိုင်ငံသို့ တင်ပို့ရောင်းချသည်။ ဓလေ့ထုံးတမ်းအရ စိုက်ပျိုးထုတ်လုပ်မှုမှ ခေတ်မီထုတ်လုပ်မှုစနစ်သို့ ကူးပြောင်းရန် ကြိုးပမ်းနေသည်။ သို့သော် ရာသီဥတုဖောက်ပြန်မှုနှင့် လုပ်သားရှားပါးမှုတို့ကြောင့် စိန်ခေါ်မှုများ ရှိနေသည်။
417,မြန်မာနိုင်ငံ၏ နှမ်းစိုက်ပျိုးထုတ်လုပ်မှုအခြေအနေကို ရှင်းပြပါ။,မြန်မာနိုင်ငံ၏ နှမ်းစိုက်ပျိုးထုတ်လုပ်မှုကို မကွေးတိုင်း၊ မန္တလေးတိုင်းနှင့် စစ်ကိုင်းတိုင်းတို့တွင် အဓိကတွေ့ရသည်။ နှမ်းဖြူ၊ နှမ်းနက်နှင့် နှမ်းညိုဟူ၍ အမျိုးအစားသုံးမျိုး စိုက်ပျိုးသည်။ ပြည်တွင်းစားသုံးဆီကြိတ်ခွဲရန်နှင့် တရုတ်၊ ဂျပန်၊ ကိုရီးယားနိုင်ငံများသို့ တင်ပို့ရန် ထုတ်လုပ်သည်။ မိုးခေါင်ရေရှားမှုဒဏ်ခံနိုင်သော နှမ်းမျိုးများ မွေးမြူထုတ်လုပ်ရန် လိုအပ်နေသည်။
418,မြန်မာနိုင်ငံ၏ ပဲမျိုးစုံစိုက်ပျိုးထုတ်လုပ်မှုအခြေအနေကို ဖော်ပြပါ။,မြန်မာနိုင်ငံ၏ ပဲမျိုးစုံစိုက်ပျိုးထုတ်လုပ်မှုတွင် ပဲတီစိမ်း၊ မတ်ပဲ၊ ပဲစဉ်းငုံ စသည့်ပဲအမျိုးအစား ၁၇ မျိုးကျော် စိုက်ပျိုးသည်။ မကွေးတိုင်း၊ စစ်ကိုင်းတိုင်းနှင့် မန္တလေးတိုင်းတို့တွင် အဓိကစိုက်ပျိုးသည်။ အိန္ဒိယနိုင်ငံသို့ အဓိကတင်ပို့ရောင်းချပြီး ပြည်တွင်းစားသုံးမှုအတွက်လည်း ထုတ်လုပ်သည်။ ရာသီဥတုဖောက်ပြန်မှုနှင့် ရောဂါပိုးမွှားကျရောက်မှုတို့ကြောင့် အထွက်နှုန်း မတည်ငြိမ်ခြင်းသည် အဓိကစိန်ခေါ်မှု ဖြစ်နေသည်။
419,မြန်မာနိုင်ငံ၏ ဆီထွက်သီးနှံစိုက်ပျိုးထုတ်လုပ်မှုအခြေအနေကို ရှင်းပြပါ။,မြန်မာနိုင်ငံ၏ ဆီထွက်သီးနှံစိုက်ပျိုးထုတ်လုပ်မှုတွင် မြေပဲ၊ နှမ်း၊ နေကြာ၊ ဆီအုန်းနှင့် ပန်းနှမ်းတို့ ပါဝင်သည်။ မကွေးတိုင်း၊ မန္တလေးတိုင်းနှင့် စစ်ကိုင်းတိုင်းတို့တွင် အဓိကစိုက်ပျိုးသည်။ ပြည်တွင်းစားသုံးဆီဖူလုံရေးအတွက် အဓိကထုတ်လုပ်သည်။ သို့သော် ပြည်တွင်းစားသုံးဆီလိုအပ်ချက်ကို ပြည့်မီအောင် မထုတ်လုပ်နိုင်သေးသဖြင့် ပုဂ္ဂလိကကဏ္ဍနှင့် ပူးပေါင်း၍ ထုတ်လုပ်မှုတိုးမြှင့်ရန် ကြိုးပမ်းနေသည်။
420,မြန်မာနိုင်ငံ၏ ဟင်းသီးဟင်းရွက်စိုက်ပျိုးထုတ်လုပ်မှုအခြေအနေကို ဖော်ပြပါ။,မြန်မာနိုင်ငံ၏ ဟင်းသီးဟင်းရွက်စိုက်ပျိုးထုတ်လုပ်မှုတွင် ခရမ်းချဉ်သီး၊ ကြက်သွန်နီ၊ ကြက်သွန်ဖြူ၊ အာလူး၊ ဟင်းနုနွယ်နှင့် ဂေါ်ဖီထုပ်တို့ အဓိကပါဝင်သည်။ ရှမ်းပြည်နယ်၊ မန္တလေးတိုင်းနှင့် ပဲခူးတိုင်းတို့တွင် အဓိကစိုက်ပျိုးသည်။ ပြည်တွင်းစားသုံးမှုအပြင် တရုတ်နှင့် စင်္ကာပူနိုင်ငံသို့ တင်ပို့ရောင်းချသည်။ ရာသီမဟုတ်ဘဲ စိုက်ပျိုးနိုင်ရန် စိုက်ပျိုးရေးနည်းပညာများ တိုးတက်အောင် ဆောင်ရွက်နေသည်။
421,မြန်မာနိုင်ငံ၏ ရေငန်ငါးမွေးမြူရေးလုပ်ငန်းအခြေအနေကို ရှင်းပြပါ။,မြန်မာနိုင်ငံ၏ ရေငန်ငါးမွေးမြူရေးလုပ်ငန်းကို ဧရာဝတီတိုင်း၊ ရခိုင်ပြည်နယ်နှင့် တနင်္သာရီတိုင်းတို့တွင် အဓိကတွေ့ရသည်။ ပုစွန်ဖြူ၊ ပုစွန်လွှ၊ ကဏန်းနှင့် ငါးခေါင်းပွတို့ကို အဓိကမွေးမြူသည်။ ပြည်တွင်းစားသုံးမှုအပြင် တရုတ်၊ ဂျပန်နှင့် အမေရိကန်နိုင်ငံသို့ တင်ပို့ရောင်းချသည်။ သို့သော် ရာသီဥတုဖောက်ပြန်မှု၊ ရေအရည်အသွေးထိန်းသိမ်းမှုနှင့် ရောဂါဘေးအန္တရာယ်တို့ကြောင့် စိန်ခေါ်မှုများ ရှိနေသည်။
