,Instruction,Output
125,အရွက်ပုပ်ရောဂါကို မည်သည့် ဘက်တီးရီးယားက ဖြစ်ပွားစေသနည်း။,အရွက်ပုပ်ရောဂါကို အများအားဖြင့် Erwinia carotovora နှင့် Xanthomonas ကဲ့သို့သော ဘက်တီးရီးယားများက ဖြစ်ပွားစေသည်။ ၎င်းတို့သည် အပင်၏ တစ်ရှူးများကို ဖျက်ဆီးပြီး အရွက်များ ပုပ်သွားစေသည်။ ဤရောဂါသည် စိုထိုင်းဆမြင့်မားသော အခြေအနေများတွင် ပိုမိုဖြစ်ပွားလေ့ရှိသည်။
126,အမြစ်ခြောက်ရောဂါ၏ အကြောင်းရင်းနှင့် ကာကွယ်ကုသနည်းများကို ဖော်ပြပါ။,အမြစ်ခြောက်ရောဂါသည် Fusarium oxysporum ကဲ့သို့သော မှိုများကြောင့် ဖြစ်ပွားသည်။ ကာကွယ်ကုသနည်းများမှာ - ၁။ ရောဂါဒဏ်ခံနိုင်သော အပင်မျိုးများ စိုက်ပျိုးခြင်း ၂။ သီးနှံလှည့်စနစ် ကျင့်သုံးခြင်း ၃။ မြေဆီလွှာကို သန့်စင်စေခြင်း ၄။ ရေနုတ်မြောင်းကောင်းမွန်အောင် ပြုလုပ်ခြင်း ၅။ မှိုသတ်ဆေးများ အသုံးပြုခြင်း ၆။ ဇီဝထိန်းချုပ်နည်းများ အသုံးပြုခြင်း
127,Nematode ရောဂါများသည် အပင်များကို မည်သို့ ထိခိုက်စေသနည်း။,Nematode ရောဂါများသည် အပင်များကို အောက်ပါနည်းလမ်းများဖြင့် ထိခိုက်စေသည် - ၁။ အမြစ်များကို ဖျက်ဆီးခြင်း ၂။ ရေနှင့် အာဟာရစုပ်ယူမှုကို အဟန့်အတားဖြစ်စေခြင်း ၃။ အပင်၏ ကြီးထွားမှုကို နှေးကွေးစေခြင်း ၄။ အရွက်များ အဝါရောင်ပြောင်းခြင်းနှင့် ညှိုးမွေ့ခြင်း ၅။ အထွက်နှုန်း လျော့ကျစေခြင်း ၆။ အခြားရောဂါပိုးများ ဝင်ရောက်ရန် လမ်းဖွင့်ပေးခြင်း
128,Phytoplasma ရောဂါများ၏ ထူးခြားသော လက္ခဏာများကို ဖော်ပြပါ။,Phytoplasma ရောဂါများ၏ ထူးခြားသော လက္ခဏာများမှာ - ၁။ အရွက်များ အဝါရောင်ပြောင်းခြင်း ၂။ ပန်းပွင့်များ အစိမ်းရောင်ပြောင်းခြင်း (phyllody) ၃။ အကိုင်းအခက်များ အလွန်အမင်း ထွက်လာခြင်း (witches' broom) ၄။ အရွက်များ ပုံပျက်ခြင်း ၅။ အပင် ပုံပျက်ကြီးထွားခြင်း ၆။ အသီးအရွယ်အစား သေးငယ်ခြင်း သို့မဟုတ် မဖြစ်ထွန်းခြင်း
129,မြေပဲတွင် တွေ့ရလေ့ရှိသော အပင်ရောဂါများကို စာရင်းပြုစုပေးပါ။,မြေပဲတွင် တွေ့ရလေ့ရှိသော အပင်ရောဂါများမှာ - ၁။ အရွက်ပြောက်ရောဂါ (Leaf spot) ၂။ သံချေးရောဂါ (Rust) ၃။ အမြစ်ပုပ်ရောဂါ (Root rot) ၄။ အညှာပုပ်ရောဂါ (Stem rot) ၅။ ဗိုင်းရပ်စ်ရောဂါများ (ဥပမာ - Peanut mottle virus) ၆။ မှဲ့ရောဂါ (Sclerotinia blight) ၇။  (Rosette disease)
130,စပါးပင်တွင် ဖြစ်ပွားတတ်သော ရောဂါများကို ဖော်ပြပါ။,စပါးပင်တွင် ဖြစ်ပွားတတ်သော ရောဂါများမှာ - ၁။ ရွက်ပြောက်ရောဂါ (Blast) ၂။ ရွက်ညှိုးရောဂါ (Bacterial blight) ၃။ ရွက်မဲရောဂါ (Sheath blight) ၄။ အဖူးပျက်ရောဂါ (Bakanae) ၅။ အညှာပုပ်ရောဂါ (Stem rot) ၆။ အနက်ရောင်ရွက်ပြောက်ရောဂါ (Brown spot) ၇။ အရွက်ကွက်ရောဂါ (Leaf streak) ၈။ စပါးဝါဖြူရောဂါ (Tungro virus)
131,ရာဘာပင်ရောဂါများနှင့် ၎င်းတို့၏ လက္ခဏာများကို ဖော်ပြပါ။,ရာဘာပင်ရောဂါများနှင့် ၎င်းတို့၏ လက္ခဏာများမှာ - ၁။ အရွက်ရောဂါ (Leaf disease) - အရွက်များပေါ်တွင် အစက်အပြောက်များ ပေါ်လာခြင်း ၂။ အခွံပုပ်ရောဂါ (Bark rot) - အခွံပုပ်ပြီး အစိုဓာတ်ထွက်ခြင်း ၃။ အမြစ်ပုပ်ရောဂါ (Root rot) - အမြစ်များပုပ်ပြီး အပင်သေဆုံးခြင်း ၄။ မှိုရောဂါ (Thread blight) - အကိုင်းအခက်များပေါ်တွင် မှိုများ ကြိုးသဖွယ် တွယ်ကပ်နေခြင်း ၅။ ရွက်ဖြူရောဂါ (Powdery mildew) - အရွက်များပေါ်တွင် အဖြူရောင်အမှုန့်များ ဖုံးအုပ်နေခြင်း
132,Cedar Apple Rust ဆိုသည်မှာ အဘယ်နည်း။,Cedar Apple Rust သည် Gymnosporangium juniperi-virginianae မှိုကြောင့် ဖြစ်ပွားသော အပင်ရောဂါတစ်မျိုးဖြစ်သည်။ ၎င်းသည် cedar နှင့် ပန်းသီးပင်များကို ထိခိုက်စေသော ရောဂါဖြစ်သည်။
133,Cedar Apple Rust ရောဂါ၏ လက္ခဏာများကို ဖော်ပြပါ။,Cedar Apple Rust ရောဂါ၏ လက္ခဏာများမှာ - ၁။ Cedar ပင်တွင် အညိုရောင် မှိုဖုများ ပေါ်လာခြင်း ၂။ ပန်းသီးပင်ရွက်များပေါ်တွင် လိမ္မော်ရောင် အစက်အပြောက်များ ပေါ်လာခြင်း ၃။ ပန်းသီးများပေါ်တွင် အညိုရောင် အစက်အပြောက်များ ဖြစ်ပေါ်ခြင်း
134,Cedar Apple Rust ရောဂါ၏ သက်တမ်းစက်ဝန်းကို ရှင်းပြပါ။,Cedar Apple Rust ရောဂါ၏ သက်တမ်းစက်ဝန်းတွင် - ၁။ Cedar ပင်တွင် မှိုဖုများ ဖြစ်ပေါ်ခြင်း ၂။ နွေဦးတွင် မှိုဖုများမှ မှိုစပိုးများ ထွက်လာခြင်း ၃။ မှိုစပိုးများ ပန်းသီးပင်သို့ ကူးစက်ခြင်း ၄။ ပန်းသီးပင်တွင် ရောဂါလက္ခဏာများ ပေါ်လာခြင်း ၅။ ပန်းသီးပင်မှ Cedar ပင်သို့ ပြန်လည်ကူးစက်ခြင်း
135,Cedar Apple Rust ရောဂါ ကာကွယ်ရန် နည်းလမ်းများကို ဖော်ပြပါ။,Cedar Apple Rust ရောဂါ ကာကွယ်ရန် နည်းလမ်းများမှာ - ၁။ ရောဂါဒဏ်ခံနိုင်သော ပန်းသီးမျိုးများ စိုက်ပျိုးခြင်း ၂။ Cedar နှင့် ပန်းသီးပင်များကို သီးခြားစိုက်ပျိုးခြင်း ၃။ Cedar ပင်များမှ မှိုဖုများကို ဖယ်ရှားခြင်း ၄။ မှိုသတ်ဆေးများ အသုံးပြုခြင်း ၅။ Cedar ပင်များကို အခြားအပင်များဖြင့် အစားထိုးစိုက်ပျိုးခြင်း
136,Cedar Apple Rust ရောဂါကြောင့် ပန်းသီးထုတ်လုပ်မှုအပေါ် မည်သို့ သက်ရောက်မှုရှိသနည်း။,Cedar Apple Rust ရောဂါသည် ပန်းသီးထုတ်လုပ်မှုအပေါ် အောက်ပါအတိုင်း သက်ရောက်မှုရှိသည် - ၁။ ပန်းသီးအရည်အသွေး ကျဆင်းခြင်း ၂။ ပန်းသီးအထွက်နှုန်း လျော့နည်းခြင်း ၃။ ပန်းသီးပင်များ အားနည်းလာခြင်း ၄။ ရောဂါကာကွယ်ရေးအတွက် ကုန်ကျစရိတ် မြင့်မားလာခြင်း ၅။ ပန်းသီးတောင်သူများ၏ ဝင်ငွေ လျော့နည်းခြင်း
137,Cedar Apple Rust ရောဂါဖြစ်ပွားရန် လိုအပ်သော ပတ်ဝန်းကျင်အခြေအနေများကို ဖော်ပြပါ။,Cedar Apple Rust ရောဂါဖြစ်ပွားရန် လိုအပ်သော ပတ်ဝန်းကျင်အခြေအနေများမှာ - ၁။ နွေဦးရာသီ စိုထိုင်းဆမြင့်မားခြင်း ၂။ အပူချိန် ၁၀-၂၀ ဒီဂရီစင်တီဂရိတ်ရှိခြင်း ၃။ Cedar နှင့် ပန်းသီးပင်များ နီးကပ်စွာ ပေါက်ရောက်နေခြင်း ၄။ လေတိုက်နှုန်း အသင့်အတင့်ရှိခြင်း ၅။ မိုးရေချိန် လုံလောက်ခြင်း
138,Cedar Apple Rust ရောဂါပိုးကို မည်သည့်နည်းဖြင့် ဖြန့်ကျက်သနည်း။,Cedar Apple Rust ရောဂါပိုးသည် အောက်ပါနည်းလမ်းများဖြင့် ဖြန့်ကျက်သည် - ၁။ လေကြောင်းမှတစ်ဆင့် မှိုစပိုးများ ပျံ့နှံ့ခြင်း ၂။ မိုးရေမှတစ်ဆင့် မှိုစပိုးများ စီးဆင်းခြင်း ၃။ ပိုးမွှားများမှတစ်ဆင့် သယ်ဆောင်ခြင်း ၄။ ရောဂါပါသော အပင်အစိတ်အပိုင်းများ သယ်ယူခြင်းမှတစ်ဆင့် ပျံ့နှံ့ခြင်း ၅။ စိုက်ပျိုးရေးကိရိယာများမှတစ်ဆင့် ကူးစက်ခြင်း
139,Cedar Apple Rust ရောဂါကို မည်သည့် မှိုသတ်ဆေးများဖြင့် ကုသနိုင်သနည်း။,Cedar Apple Rust ရောဂါကို ကုသရန် အသုံးပြုနိုင်သော မှိုသတ်ဆေးများမှာ - ၁။ Myclobutanil ၂။ Propiconazole ၃။ Tebuconazole ၄။ Captan ၅။ Mancozeb ၆။ Chlorothalonil ၇။ Ferbam။ ဤဆေးများကို ရောဂါမဖြစ်မီ ကြိုတင်ကာကွယ်ရန် သို့မဟုတ် ရောဂါစတင်ဖြစ်ပွားချိန်တွင် အသုံးပြုနိုင်သည်။
140,Cedar Apple Rust ရောဂါဒဏ်ခံနိုင်သော ပန်းသီးမျိုးများကို ဖော်ပြပါ။,Cedar Apple Rust ရောဂါဒဏ်ခံနိုင်သော ပန်းသီးမျိုးများမှာ - ၁။ Liberty ၂။ Enterprise ၃။ Redfree ၄။ Williams Pride ၅။ GoldRush ၆။ Pristine ၇။ Sundance ၈။ Freedom ၉။ Jonafree ၁၀။ Nova Easygro။ ဤမျိုးများကို စိုက်ပျိုးခြင်းဖြင့် Cedar Apple Rust ရောဂါကို ကာကွယ်နိုင်သည်။
141,Cedar Apple Rust ရောဂါကြောင့် ပန်းသီးပင်၏ မည်သည့်အစိတ်အပိုင်းများ ထိခိုက်နိုင်သနည်း။,Cedar Apple Rust ရောဂါကြောင့် ပန်းသီးပင်၏ အောက်ပါအစိတ်အပိုင်းများ ထိခိုက်နိုင်သည် - ၁။ အရွက်များ ၂။ အသီးများ ၃။ ပန်းပွင့်များ ၄။ အညွန့်သစ်များ ၅။ အကိုင်းအခက်သေးများ။ ရောဂါပြင်းထန်ပါက တစ်ပင်လုံး အားနည်းပြီး သေဆုံးနိုင်သည်။
142,Cedar Apple Rust ရောဂါ၏ သမိုင်းကြောင်းကို အကျဉ်းချုပ် ဖော်ပြပါ။,Cedar Apple Rust ရောဂါ၏ သမိုင်းကြောင်းမှာ - ၁။ ၁၈၆၇ ခုနှစ်တွင် ပထမဆုံးအကြိမ် တွေ့ရှိခဲ့သည်။ ၂။ ၁၈၈၀ ခုနှစ်တွင် ရောဂါ၏ သက်တမ်းစက်ဝန်းကို ဖော်ထုတ်နိုင်ခဲ့သည်။ ၃။ ၁၉၃၀ ခုနှစ်များတွင် အမေရိကန်ပြည်ထောင်စု၌ ကြီးမားသော ထိခိုက်မှုများ ဖြစ်ပေါ်ခဲ့သည်။ ၄။ ၁၉၅၀ ခုနှစ်များတွင် ရောဂါဒဏ်ခံနိုင်သော ပန်းသီးမျိုးများ စတင်မွေးမြူခဲ့သည်။ ၅။ ယနေ့အချိန်ထိ စိုက်ပျိုးရေးကဏ္ဍတွင် အရေးပါသော ရောဂါတစ်ခုအဖြစ် ရှိနေဆဲဖြစ်သည်။
143,Cedar Apple Rust ရောဂါဖြစ်ပွားမှုကို မည်သို့ စောင့်ကြည့်လေ့လာနိုင်သနည်း။,Cedar Apple Rust ရောဂါဖြစ်ပွားမှုကို စောင့်ကြည့်လေ့လာရန် နည်းလမ်းများမှာ - ၁။ ပုံမှန် ကွင်းဆင်းစစ်ဆေးခြင်း ၂။ ရာသီဥတုအခြေအနေများကို စောင့်ကြည့်ခြင်း ၃။ Cedar ပင်များတွင် မှိုဖုများ ပေါ်လာခြင်း ရှိ/မရှိ စစ်ဆေးခြင်း ၄။ ပန်းသီးပင်ရွက်များပေါ်တွင် လိမ္မော်ရောင်အစက်များ ပေါ်လာခြင်း ရှိ/မရှိ စစ်ဆေးခြင်း ၅။ ရောဂါဖြစ်ပွားမှု ခန့်မှန်းချက်ပုံစံများ အသုံးပြုခြင်း
144,Apple Cedar Rust ဖြစ်ပွားသည့်အချိန်ကို ဖော်ပြပါ။,Apple Cedar Rust သည် နွေဦးနှင့် နွေရာသီအစောပိုင်းတွင် အဖြစ်အများဆုံးဖြစ်သည်။
145,Apple Cedar Rust ၏ infection cycle ကို ရှင်းပြပါ။,Apple Cedar Rust သည် နွေဦးတွင် စတင်ပြီး နွေရာသီတစ်လျှောက် ဆက်လက်ဖြစ်ပွားသည်။
146,Apple Cedar Rust သည် မည်သည့်အချိန်တွင် အန္တရာယ်အရှိဆုံးဖြစ်သနည်း။,ပန်းသီးပင်များ အပွင့်ပွင့်ချိန်နှင့် အသီးစတင်သီးချိန်တွင် Apple Cedar Rust သည် အန္တရာယ်အရှိဆုံးဖြစ်သည်။
147,Apple Cedar Rust ကို မည်သည့်အချိန်တွင် စစ်ဆေးသင့်သနည်း။,နွေဦးနှင့် နွေရာသီအစောပိုင်းတွင် ပန်းသီးပင်များကို ပုံမှန်စစ်ဆေးသင့်သည်။
148,Apple Cedar Rust ကာကွယ်ရန် မည်သည့်အချိန်တွင် ဆောင်ရွက်သင့်သနည်း။,နွေဦးမတိုင်မီ သို့မဟုတ် နွေဦးအစောပိုင်းတွင် ကာကွယ်ဆေးဖြန်းခြင်းကို စတင်သင့်သည်။
149,Apple Cedar Rust ၏ လက္ခဏာများကို မည်သည့်အချိန်တွင် ပထမဆုံးတွေ့ရှိနိုင်သနည်း။,Apple Cedar Rust ၏ ပထမဆုံး လက္ခဏာများကို နွေဦးလယ်မှ နွေဦးနှောင်းပိုင်းတွင် တွေ့ရှိနိုင်သည်။
150,Apple Cedar Rust ကို မည်သည့်အချိန်တွင် ကုသင့်သနည်း။,ရောဂါလက္ခဏာများ စတင်တွေ့ရှိသည်နှင့် ချက်ချင်းကုသမှုစတင်သင့်သည်။ နွေရာသီတစ်လျှောက် ဆက်လက်ကုသသင့်သည်။
151,Apple Cedar Rust ကာကွယ်ရေးအတွက် ကိုင်းဖြတ်ခြင်း ကို မည်သည့်အချိန်တွင် ပြုလုပ်သင့်သနည်း။,ကိုင်းဖြတ်ခြင်း ကို ဆောင်းရာသီနှောင်းပိုင်း သို့မဟုတ် နွေဦးအစောပိုင်းတွင် ပြုလုပ်သင့်သည်။
152,Apple Cedar Rust ရောဂါပိုးများ မည်သည့်အချိန်တွင် ပျံ့နှံ့မှုအမြင့်ဆုံးဖြစ်သနည်း။,နွေရာသီအစောပိုင်းတွင် Apple Cedar Rust ရောဂါပိုးများ ပျံ့နှံ့မှုအမြင့်ဆုံးဖြစ်သည်။
153,ပိုးသတ်ဆေးအန္တရာယ်၏ အဓိကအကျိုးဆက်များကို ဖော်ပြပါ။,ပိုးသတ်ဆေးအန္တရာယ်၏ အဓိကအကျိုးဆက်များမှာ ကျန်းမာရေးပြဿနာများ၊ ပတ်ဝန်းကျင်ညစ်ညမ်းမှု၊ နှင့် ဇီဝမျိုးစုံမျိုးကွဲများ ပျက်စီးခြင်းတို့ဖြစ်သည်။
154,ပိုးသတ်ဆေးကြောင့် ဖြစ်ပေါ်နိုင်သော ကျန်းမာရေးပြဿနာများကို စာရင်းပြုစုပါ။,ပိုးသတ်ဆေးကြောင့် အရေပြားယားယံခြင်း၊ မျက်စိယားယံခြင်း၊ ခေါင်းကိုက်ခြင်း၊ မူးဝေခြင်း၊ အန်ခြင်း၊ ကင်ဆာရောဂါ နှင့် မျိုးပွားမှုပြဿနာများ ဖြစ်ပေါ်နိုင်သည်။
155,ပိုးသတ်ဆေးအန္တရာယ်ကို လျော့ချရန် နည်းလမ်းများ ဖော်ပြပါ။,ပိုးသတ်ဆေးအန္တရာယ်လျော့ချရန် သဘာဝနည်းလမ်းများသုံးခြင်း၊ integrated pest management စနစ်သုံးခြင်း၊ ဘေးကင်းသောပိုးသတ်ဆေးများရွေးချယ်သုံးစွဲခြင်း နှင့် ပိုးသတ်ဆေးသုံးစွဲမှုလျော့ချခြင်းတို့ ပြုလုပ်နိုင်သည်။
156,ပိုးသတ်ဆေးများ ပတ်ဝန်းကျင်ကို မည်ကဲ့သို့ ထိခိုက်စေသနည်း။,ပိုးသတ်ဆေးများသည် မြေဆီလွှာနှင့် ရေအရင်းအမြစ်များကို ညစ်ညမ်းစေပြီး၊ ပျားနှင့် ငှက်များကဲ့သို့သော အခြားသတ္တဝါများကိုပါ သေဆုံးစေနိုင်သည်။ ထို့ပြင် ဇီဝမျိုးစုံမျိုးကွဲများ ပျက်သုဥ်းခြင်းကိုလည်း ဖြစ်စေနိုင်သည်။
157,ပိုးသတ်ဆေးအန္တရာယ်ကို ကာကွယ်ရန် ကိုယ်ရေးကာကွယ်မှုပစ္စည်းများ (PPE) အကြောင်း ရှင်းပြပါ။,ပိုးသတ်ဆေးအန္တရာယ်ကာကွယ်ရန် လက်အိတ်၊ မျက်နှာဖုံး၊ ရှည်လျားသောအင်္ကျီနှင့် ဘောင်းဘီ၊ ရေစိုခံဖိနပ်၊ မျက်မှန် နှင့် respirator တို့ကို ဝတ်ဆင်သင့်သည်။ PPE သည် ပိုးသတ်ဆေးနှင့် တိုက်ရိုက်ထိတွေ့မှုကို ကာကွယ်ပေးသည်။
158,ပိုးသတ်ဆေးအန္တရာယ်ကို လျော့ချနိုင်သော သီးနှံစိုက်ပျိုးရေးနည်းစနစ်များကို ဖော်ပြပါ။,ပိုးသတ်ဆေးအန္တရာယ်လျော့ချရန် သီးနှံအလှည့်ကျစနစ်၊ အပင်များရောနှောစိုက်ပျိုးခြင်း၊ ဇီဝထိန်းချုပ်နည်း၊ ကာကွယ်နိုင်စွမ်းရှိသောအပင်မျိုးများ ရွေးချယ်စိုက်ပျိုးခြင်း နှင့် သဘာဝမြေသြဇာသုံးစွဲခြင်းတို့ကို အသုံးပြုနိုင်သည်။
159,ပိုးသတ်ဆေးအန္တရာယ်ကြောင့် စားသုံးသူများအပေါ် မည်သို့သက်ရောက်မှုရှိသနည်း။,စားသုံးသူများသည် ပိုးသတ်ဆေးကြွင်းကျန်များပါဝင်သော အစားအစာများ စားသုံးမိခြင်းဖြင့် ကျန်းမာရေးပြဿနာများ ကြုံတွေ့နိုင်သည်။ ရေရှည်တွင် နာတာရှည်ရောဂါများ၊ ကိုယ်ခံအားစနစ်ပြဿနာများ နှင့် ကလေးများတွင် ဖွံ့ဖြိုးမှုဆိုင်ရာ ချို့ယွင်းချက်များ ဖြစ်ပေါ်နိုင်သည်။
